Title,URL,Date,Image
"Sixth JBC meeting underway, amid Cambodia-Thailand border tensions",https://www.phnompenhpost.comhttps://www.phnompenhpost.com/national/sixth-jbc-meeting-underway-amid-cambodia-thailand-border-tensions,14 June 2025 | 12:39,https://pppenglish.sgp1.digitaloceanspaces.com/image/main/20256/14_6_2025_2464.jpg
Dai-ichi Life and Woori Bank Officially Launch Strategic Bancassurance Partnership to Expand Financial Inclusion in Cambodia,https://www.phnompenhpost.comhttps://www.phnompenhpost.com/business/dai-ichi-life-and-woori-bank-officially-launch-strategic-bancassurance-partnership-to-expand-financial-inclusion-in-cambodia,14 June 2025 | 12:25,https://pppenglish.sgp1.digitaloceanspaces.com/image/main/20256/14_6_2025_2_1_.jpg
Thailand and its unilateral border maps – the back story revealed,https://www.phnompenhpost.comhttps://www.phnompenhpost.com/opinion/thailand-and-its-unilateral-border-maps-the-back-story-revealed,14 June 2025 | 10:41,https://pppenglish.sgp1.digitaloceanspaces.com/image/main/20256/14_6_2025_fff.jpg
"Manet reiterates: Border restrictions, disputed areas off table for JBC talks",https://www.phnompenhpost.comhttps://www.phnompenhpost.com/national/manet-reiterates-border-restrictions-disputed-areas-off-table-for-jbc-talks,13 June 2025 | 23:14,https://pppenglish.sgp1.digitaloceanspaces.com/image/main/20256/13_6_2025_aaa.jpg
Cambodia calls for global community to press Thailand for ICJ resolution of border issues,https://www.phnompenhpost.comhttps://www.phnompenhpost.com/national/cambodia-calls-for-global-community-to-press-thailand-for-icj-resolution-of-border-issues,13 June 2025 | 22:52,https://pppenglish.sgp1.digitaloceanspaces.com/image/main/20256/13_6_2025_zazaza.jpg
Casting the net wide: Officers seize over ten tonnes of illegally imported Thai fish,https://www.phnompenhpost.comhttps://www.phnompenhpost.com/national/casting-the-net-wide-officers-seize-over-ten-tonnes-of-illegally-imported-thai-fish,13 June 2025 | 17:26,https://pppenglish.sgp1.digitaloceanspaces.com/image/main/20256/13_6_2025_a1823.jpg
"Adverse weather drives fall in Kampot, Kep salt production",https://www.phnompenhpost.comhttps://www.phnompenhpost.com/business/adverse-weather-drives-fall-in-kampot-kep-salt-production,13 June 2025 | 17:24,https://pppenglish.sgp1.digitaloceanspaces.com/image/main/20256/13_6_2025_a1819.jpg
Four dead in Phnom Penh house fire,https://www.phnompenhpost.comhttps://www.phnompenhpost.com/national/four-dead-in-phnom-penh-house-fire,13 June 2025 | 16:12,https://pppenglish.sgp1.digitaloceanspaces.com/image/main/20256/13_6_2025_a1807.jpg
"In a Slowing Economy, It Pays to Modernise",https://www.phnompenhpost.comhttps://www.phnompenhpost.com/opinion/in-a-slowing-economy-it-pays-to-modernise,13 June 2025 | 15:54,https://pppenglish.sgp1.digitaloceanspaces.com/image/main/20256/13_6_2025_a1816.jpg
"Cambodia shutters key Battambang border crossing, sparks trade tensions",https://www.phnompenhpost.comhttps://www.phnompenhpost.com/national/cambodia-shutters-key-battambang-border-crossing-sparks-trade-tensions,13 June 2025 | 15:51,https://pppenglish.sgp1.digitaloceanspaces.com/image/main/20256/13_6_2025_a1815.jpg
New food lab committee formed to bolster food safety standards,https://www.phnompenhpost.comhttps://www.phnompenhpost.com/national/new-food-lab-committee-formed-to-bolster-food-safety-standards,13 June 2025 | 15:46,https://pppenglish.sgp1.digitaloceanspaces.com/image/main/20256/13_6_2025_a1814.jpg
"Business insiders call for increased investment, support for local products",https://www.phnompenhpost.comhttps://www.phnompenhpost.com/business/business-insiders-call-for-increased-investment-support-for-local-products,13 June 2025 | 15:36,https://pppenglish.sgp1.digitaloceanspaces.com/image/main/20256/13_6_2025_a1813.jpg
Cambodia and EU Require Mutual Understanding and Respect,https://www.phnompenhpost.comhttps://www.phnompenhpost.com/opinion/cambodia-and-eu-require-mutual-understanding-and-respect,13 June 2025 | 15:29,https://pppenglish.sgp1.digitaloceanspaces.com/image/main/20256/13_6_2025_a1812.jpg
"Khmer Boxing Federation bans Thai fighters from all competitions, effective immediately",https://www.phnompenhpost.comhttps://www.phnompenhpost.com/sport/khmer-boxing-federation-bans-thai-fighters-from-all-competitions-effective-immediately,13 June 2025 | 13:37,https://pppenglish.sgp1.digitaloceanspaces.com/image/main/20256/13_6_2025_2452.jpg
"Lon Nol's Cambodia '72: absolute power, absolute lies",https://www.phnompenhpost.comhttps://www.phnompenhpost.com/national/lon-nols-cambodia-72-absolute-power-absolute-lies,10 April 1998 | 07:00,https://pppenglish.sgp1.digitaloceanspaces.com/image/main/
Hun Sen appeals to government response to Thai border restrictions,https://www.phnompenhpost.comhttps://www.phnompenhpost.com/national/hun-sen-appeals-to-government-response-to-thai-border-restrictions,13 June 2025 | 12:39,https://pppenglish.sgp1.digitaloceanspaces.com/image/main/20256/13_6_2025_2451.jpg
Self proclaimed ‘sheet head’ brings house down in excel-lent performance,https://www.phnompenhpost.comhttps://www.phnompenhpost.com/arts-culture/self-proclaimed-sheet-head-brings-house-down-in-excel-lent-performance,13 June 2025 | 12:36,https://pppenglish.sgp1.digitaloceanspaces.com/image/main/20256/13_6_2025_2450.jpg
From uncertainty to security: How Cambodia’s farmers are weathering climate change with crop insurance,https://www.phnompenhpost.comhttps://www.phnompenhpost.com/opinion/from-uncertainty-to-security-how-cambodia-s-farmers-are-weathering-climate-change-with-crop-insurance,13 June 2025 | 12:28,https://pppenglish.sgp1.digitaloceanspaces.com/image/main/20256/13_6_2025_2447.jpg
Metfone Ensures Network Stability Amid Submarine Cable Disruptions at the Border,https://www.phnompenhpost.comhttps://www.phnompenhpost.com/business/metfone-ensures-network-stability-amid-submarine-cable-disruptions-at-the-border,13 June 2025 | 11:18,https://pppenglish.sgp1.digitaloceanspaces.com/image/main/20256/13_6_2025_zzzz.jpg
Decks cleared for delivery of China’s indigenous AG600 seaplane,https://www.phnompenhpost.comhttps://www.phnompenhpost.com/international/decks-cleared-for-delivery-of-china-s-indigenous-ag600-seaplane,13 June 2025 | 08:37,https://pppenglish.sgp1.digitaloceanspaces.com/image/main/20256/13_6_2025_2446.jpg
